{
  "$schema": "https://json-schema.org/draft/2020-12/schema",
  "$id": "https://microc2.local/schemas/task-result-v1.schema.json",
  "title": "MicroC2 Task Result v1",
  "description": "Terminal result submitted by an agent for a correlated task. Module-specific output.data contracts are selected from the module catalog by the server.",
  "type": "object",
  "additionalProperties": false,
  "required": [
    "schema_version",
    "task_id",
    "agent_id",
    "outcome",
    "started_at",
    "completed_at",
    "output"
  ],
  "properties": {
    "schema_version": {
      "const": 1
    },
    "task_id": {
      "type": "string",
      "minLength": 1,
      "maxLength": 128,
      "pattern": "^[A-Za-z0-9_.:-]+$"
    },
    "agent_id": {
      "type": "string",
      "minLength": 1,
      "maxLength": 128,
      "pattern": "^[A-Za-z0-9_.:-]+$"
    },
    "outcome": {
      "enum": [
        "completed",
        "failed"
      ]
    },
    "started_at": {
      "type": "string",
      "format": "date-time",
      "maxLength": 35,
      "description": "Non-zero RFC3339 execution start instant."
    },
    "completed_at": {
      "type": "string",
      "format": "date-time",
      "maxLength": 35,
      "description": "Non-zero RFC3339 completion instant that must not precede started_at."
    },
    "exit_code": {
      "type": [
        "integer",
        "null"
      ],
      "minimum": -2147483648,
      "maximum": 2147483647
    },
    "output": {
      "type": "object",
      "additionalProperties": false,
      "required": [
        "stdout",
        "stderr"
      ],
      "properties": {
        "stdout": {
          "type": "string",
          "maxLength": 1048576
        },
        "stderr": {
          "type": "string",
          "maxLength": 1048576
        },
        "data": {
          "type": "object",
          "maxProperties": 64,
          "description": "Structured module evidence. The enclosing module contract defines its exact fields."
        }
      }
    },
    "error": {
      "type": "string",
      "maxLength": 8192
    }
  },
  "allOf": [
    {
      "if": {
        "properties": {
          "outcome": {
            "const": "completed"
          }
        },
        "required": [
          "outcome"
        ]
      },
      "then": {
        "properties": {
          "exit_code": {
            "const": 0
          },
          "error": false
        },
        "required": [
          "exit_code"
        ]
      }
    },
    {
      "if": {
        "properties": {
          "outcome": {
            "const": "failed"
          }
        },
        "required": [
          "outcome"
        ]
      },
      "then": {
        "properties": {
          "error": {
            "type": "string",
            "minLength": 1,
            "maxLength": 8192,
            "pattern": "\\S"
          }
        },
        "required": [
          "error"
        ]
      }
    }
  ]
}
